{
  "schema_version": 1,
  "operation": "download",
  "urls": ["https://www.youtube.com/watch?v=BaW_jenozKc"],
  "auth_mode": "public",
  "rights_basis": {
    "category": "service_authorized",
    "statement": "Public yt-dlp test media used for a bounded integration test."
  },
  "output_root": "/tmp/amsoft-youtube-example",
  "playlist_policy": "single",
  "max_items": 1,
  "media_mode": "audio",
  "audio_format": "m4a",
  "subtitle_languages": ["en"],
  "subtitle_format": "vtt",
  "automatic_subtitles": false,
  "write_thumbnail": true,
  "embed_thumbnail": true,
  "embed_metadata": true,
  "embed_chapters": true,
  "split_chapters": false,
  "sections": [],
  "sponsorblock_mark": [],
  "sponsorblock_remove": [],
  "experimental_live_from_start": false,
  "overwrite": false,
  "concurrent_fragments": 1,
  "sleep_requests": 1,
  "timeout": 300
}
